id,name,mode,description,weight,suggestion_value,suggestion_text_if_over,suggestion_text_if_below
165,Subtopic Density,text,Density of subtopic terms,4,0.6,Too many subtopic terms; may dilute focus.,Add subtopic terms for better balance.
166,Keyword Prominence Score,text,Position-based keyword prominence,5,0.8,Keywords too front-loaded; vary placement.,Improve keyword prominence earlier in text.
167,Keyword Placement Score,text,Placement in headings and structure,5,0.8,Overused keywords in headings; reduce.,Include primary keywords in key sections.
168,Content Freshness,text,Recency of content topics,5,90,Outdated references found; refresh content.,Add more recent references or data.
169,Internal Link Count,text,Number of internal links,4,10,Too many internal links; may clutter text.,Add internal links to related pages.
170,Outbound Link Count,text,Number of outbound links,4,5,Too many outbound links; reduce leakage.,Add outbound links to authoritative sources.
171,Anchor Text Quality,text,Quality of anchor text for SEO,4,0.8,Generic anchor texts detected; refine.,Add descriptive anchor text for SEO relevance.
172,Link Diversity,text,Diversity of linked domains,3,0.7,Too many links from same domain.,Add external sources for link diversity.
173,Content Readability Score,text,Aggregate readability score,5,70,Content too hard to read; simplify language.,Add complexity for expert readability.
174,Sentence Fluency,text,Sentence flow smoothness,4,0.8,Sentences flow too predictably; vary rhythm.,Improve sentence flow for better engagement.
175,Paragraph Fluency,text,Paragraph flow smoothness,4,0.8,Paragraphs transition too abruptly.,Add connecting phrases for smooth transitions.
176,Content Clarity Score,text,Overall clarity assessment,5,0.8,Overclarified content; may sound robotic.,Clarify sentences for better comprehension.
177,Engagement Potential,text,Potential for user engagement,4,0.7,Overstimulating; may appear clickbait.,Add interactive or emotional phrasing to engage users.
178,Call-to-Action Effectiveness,text,CTA effectiveness assessment,4,0.8,Too pushy CTA detected; soften tone.,Strengthen CTA for clear action guidance.
179,SEO Score Placeholder,text,SEO score placeholder,5,1,SEO optimization too intense; review factors.,Increase SEO optimization for better ranking.
180,GEO Score Placeholder,text,GEO score placeholder,5,1,GEO focus too heavy; rebalance factors.,Enhance GEO relevance to improve AI citation score.
181,Hybrid Score Placeholder,text,Hybrid SEO+GEO score,5,1,Hybrid optimization too skewed toward one type.,Balance SEO and GEO strategies evenly.
182,Keyword Repetition Pattern,text,Check repeated keyword sequences,4,0.5,Excessive keyword repetition pattern.,Add keyword variety to avoid redundancy.
183,Keyword Gap Analysis,text,Missing keywords compared to topic,4,0.5,Too many keywords covered; trim focus.,Add missing related keywords for completeness.
184,Content Optimization Suggestions,text,Automated suggestions for improvement,4,1,Over-optimized content; humanize tone.,Use AI suggestions to enhance optimization.
185,Content Structure Score,text,Structure completeness score,4,0.8,Overstructured; lacks natural flow.,Add structure for better logical sequence.
186,Header Coverage,text,Presence of H2/H3 for all sections,4,0.9,Too many headers; simplify hierarchy.,Add missing headers for full coverage.
187,Content Flow Score,text,Flow between sections,4,0.8,Sections blend too much; separate topics clearly.,Improve flow to connect section ideas.
188,Sentence Transition Score,text,Sentence transition quality,4,0.7,Transitions too mechanical or repetitive.,Add transitions for smoother sentence flow.
189,Paragraph Transition Score,text,Paragraph transition quality,4,0.7,Transitions too forced; reduce connectors.,Improve transitions for better readability.
190,Topic Consistency,text,Consistency in topic coverage,5,0.9,Topic repetition or drift detected.,Maintain consistent coverage across the piece.
191,Subtopic Consistency,text,Consistency in subtopic coverage,4,0.8,Uneven subtopic coverage.,Expand on missing subtopics for completeness.
192,Contextual Keyword Relevance,text,Relevance of keywords to context,5,0.8,Keywords misplaced contextually; revise phrasing.,Add contextual relevance to keyword usage.
193,Semantic Keyword Coverage,text,Coverage of semantic keywords,5,0.8,Overuse of semantic keywords; reduce repetition.,Add semantic keywords for better comprehension.
194,Engagement Phrases,text,Presence of engagement-focused phrases,3,5,Too many engagement hooks; tone down.,Add engagement-focused phrases for user retention.
195,Content Persuasiveness,text,Persuasiveness of writing,4,0.8,Too persuasive; may feel forced.,Strengthen persuasive elements for conversion.
196,Readability Improvement,text,Suggestions for readability improvements,4,1,Readability already high; avoid oversimplifying.,Apply readability improvements for clarity.
197,SEO Optimization Potential,text,Potential SEO improvements,5,1,SEO saturation; maintain natural tone.,Optimize content with missing SEO opportunities.
198,GEO Optimization Potential,text,Potential GEO improvements,5,1,Overfitted for AI engines; balance human tone.,Increase AI contextual signals for better citation.
199,Hybrid Optimization Score,text,Combined SEO+GEO optimization score,5,1,Hybrid score imbalance detected; tune parameters.,Improve hybrid synergy between SEO and GEO.
200,Content Recommendation Placeholder,text,Automated recommendations placeholder,5,1,Excessive recommendations; simplify output.,Add more personalized recommendations for clarity.